{
  "schema_version": 2,
  "profile": "device",
  "destination": "device",
  "deployables": [
    {
      "integration": "AthleteIdentity",
      "deployable": "IdentityClient"
    }
  ],
  "topology": {
    "AthleteIdentity.IdentityClient": {
      "run": "host",
      "environment": {
        "ATHLETE_IDENTITY_KEY_PROVIDER": "filesystem"
      }
    }
  }
}
